area,year,accomplishment,where,link
Workshop di Introduzione alla Biostatistica con R,2024,Corso intensivo di 4 gg per dottorandi UE nel campo clinico/sanitario,"Nijmegen, Netherland",\href{https://r4biostats.com/}{Dedicated website}
Studio di linguistica computazionale applicata alla politica dello sviluppo,2022 - Oggi,Influenza degli slogan nelle politiche pubbliche (_in corso_),online,\href{https://policylexicon.com/}{Dedicated website}
Report di posizionamento co-creato per conto della diocesi di Pavia, 2023 - 2024, IDEE PER PAVIA: una scrittura collettiva per il bene comune, Pavia PV, \href{https://lulliter.github.io/ideeperpavia//}{Dedicated website}
Blog personale di Data Science,2018 - Oggi,Portafoglio illustrativo di progetti di data Science,online,\href{https://luisamimmi.org/}{https://luisamimmi.org/}
Apprendimento del programma R ed altri linguaggi software, 2023 - Oggi,Raccolta di tutorial tecnici,online,\href{https://lulliter.github.io/nerd_help/}{Tutorial su R}
Analisi sull'offerta e qualità dell'acqua in Brasile,2018 - 2019,Censimento del servizio idrico in Brasile,"Washington, DC",\href{https://lulliter.github.io/BrazilWaterSurvey/}{Dedicated website}
Analisi su dati pubblici di immigrazione in USA,2019,Le tempistiche di ottenimento della carta verde in USA,online,\href{https://raw.githubusercontent.com/Lulliter/GreenCard/master/05_Analysis.pdf}{Breve studio e script di programmazione in R}
Analisi su dati di migrazioni per lavoro,2018,Indagine su dati LinkedIn sugli spostamenti per lavoro e la competitività delle città,online,\href{https://raw.githubusercontent.com/Lulliter/Linkedin/master/Linkedin-Analysis3.pdf}{Breve studio e script di programmazione in R}
Analisi su dati WDI della Banca Mondiale,2018,Breve studio sull'indicatore WDI 'Life Expectancy' della Banca Mondiale,online,\href{https://raw.githubusercontent.com/Lulliter/DECdatascience/master/Part_1_Output.pdf}{Breve studio e script di programmazione in R}
