name,year,explain
\href{https://policylexicon.com/}{Studio dell'impatto degli slogan nelle politiche pubbliche},2022 - Oggi, Progetto di studio di linguistica computazionale applicata alla politica dello sviluppo (in corso)
\href{https://r4biostats.com/}{Workshop di Introduzione alla Biostatistica con R}, 2024, MAteriali del corso intensivo di 4 giorni per studenti di dottorato in materie scientifiche
\href{https://ideeperpavia.com/}{IDEE PER PAVIA: una scrittura collettiva per il bene comune},2024, Documento elaborato dalla Scuola di Cittadinanza e Partecipazione della Diocesi di Pavia in vista delle elezioni amministrative di giugno 2024
\href{https://luisamimmi.org/}{Blog personale di Data Science},2018 - Oggi,Portafoglio illustrativo di progetti di Data Science
\href{https://lulliter.github.io/nerd_help/}{Note tecniche e tutorial su R},2024 - Oggi,Blog e collezione di tutorial per l'apprendimento del programma R ed altri linguaggi software
\href{https://lulliter.github.io/BrazilWaterSurvey/}{Brazil Water Suppliers},2018/2019,Analisi condotta sui gestori di acqua in Brasile
\href{https://raw.githubusercontent.com/Lulliter/GreenCard/master/05_Analysis.pdf}{Green Card processing time under Trump},2019,Breve articolo e script di programmazione
\href{https://raw.githubusercontent.com/Lulliter/Linkedin/master/Linkedin-Analysis3.pdf}{Analysis of job migrants and cities' competitiveness through LinkedIn data},2018,Presentazione e script di programmazione
\href{https://raw.githubusercontent.com/Lulliter/DECdatascience/master/Part_1_Output.pdf}{Analysis of WDI indicator \"Life expectancy over time\"},2018,Breve articolo e script di programmazione
