title,org,division,unit,where,description_1,description_2,description_3,detail,start_day,start_month,start_year,end_day,end_month,end_year
Policy Analyst & Data Scientist,Freelance Consulting,,,"Milan, Italy & remote","Advised different Italian entities (government, academia and think tanks) on data-driven policy analysis",Prepared intensive courses on Statistics and Machine Learning with R,Redacted 1 peer-reviewed article on infrastructure maintenance,,01,01,2022,NA,NA,NA
Expert in EU Funds Analysis,Italian Presidency of the Council of Ministers,Dip. Cohesion Policies,PNRR Unit,"Rome, Italy",Advised on monitoring of PNRR (EU funds for regional cohesion) advancement,Built automated reports to track funded projects and their outputs,,,03,02,2023,14,08,2024
Sr. Economic Advisor (G20 task force),Italian Ministry of Economy & Finance,International Financial Relations,G7/G20 Office,"Rome, Italy",Advised the Infrastructure Working Group (IWG) during Italy's G20 Presidency in 2021,Coordinated 3 junior resources and the infrastructure resilience and maintenance workstream,Drafted the 'G20 Policy Agenda on Infrastructure Maintenance' endorsed by Finance Ministers,,03,02,2020,31,12,2021
Advisor for EU funding proposal,CSIL,,,"Milan, Italy",Advised on tender for research project on 'EU Lagging Regions: state of play and future challenges' funded by the EU,Contributed to preparation of technical and financial proposal to the European Parliament's Committee on Regional Development (REGI),,,02,02,2020,23,03,2020
Research Fellow (Water Division),Inter-American Development Bank,Infrastructure Dept.,Water Div.,"Washington DC, US",Conducted surveys and analyses of supply and demand of Water and Sanitation in Latin America,Supervised a consulting team that conducted field surveys in Brazil and Mexico,Contributed to 2020 IADB flagship publication on Infrastructure 'From Structures to Services: The Path to Better Infrastructure in Latin America and the Caribbean',,01,05,2018,03,01,2019
Senior M&E Specialist (at Multilateral Trust Funds),World Bank,Multilateral Trust Funds administered by WB,GPOBA & WPP,"Washington DC, US",Designed and managed M&E frameworks for 2 multi-donor development trust funds: WPP and GPOBA,"Conducted feasibility and impact evaluation studies focused on infrastructure poverty dimensions in rural and urban areas of Mumbai (India), Nairobi (Kenya), Kampala (Uganda), and Dhaka (Bangladesh)","Redacted 3 peer-reviewed publications, including pilot research on integrating satellite imagery and household survey data to estimate Slum Severity Index in Dhaka",,23,03,2009,30,04,2018
Policy Analyst (Social Protection & Health Div.),Inter-American Development Bank,Social Protection & Health Div.,,"Washington DC, US","Assisted in social development project on education and vocational training in Fortaleza, Brazil",Presented comparative policy paper on entrepreneurship promotion to Division,,,01,10,2008,28,02,2009
Summer Intern (Social Inclusion and Education),AVSI International NGO,,,"Rio and Belo Horizonte, Brazil",Initiated empirical study of slum electrification project 'Conviver' (Belo Horizonte),Advised on data sharing among AVSI inter-city educational interventions in urban 'favelas',,,01,06,2007,12,08,2007
Business Intelligence Analyst,Value Partners Management Consulting,Research & Information Dept.,,"Milan, Italy",Provided business intelligence for several Italian clients and their domestic and international operations,Participated in due diligences and competitive positioning analyses to assist private equity investors in a industrial operations,,,01,10,2001,30,06,2006